,date,id,title,publishedAt,viewCount,likeCount,dislikeCount,favoriteCount,commentCount,age,playListTitle
10587,2020-11-25,PFTa0YQggww,Magnificent Menorahs!,2020-11-11 15:23:17+00:00,0,1,0,0,0.0,child,Barnet libraries for children
10562,2020-11-25,y-BEL5seUAk,Silly Squad Crossword,2020-07-31 13:19:45+00:00,12,1,0,0,0.0,child,Barnet libraries for children
10559,2020-11-25,rGDxS4Uk1V4,Find the Silly Squad,2020-07-28 07:50:31+00:00,14,1,0,0,0.0,child,Barnet libraries for children
10583,2020-11-25,mMko7UYWL3k,Black Scientists and Inventors  - A quiz for Black History Month 2020,2020-10-22 07:51:19+00:00,15,0,0,0,0.0,adult,
10558,2020-11-25,zj7TO-X10HM,Silly Squad Book Reveal,2020-07-28 10:51:44+00:00,17,1,0,0,0.0,child,Barnet libraries for children
10574,2020-11-25,A8AkRP8n2qQ,Barnet Libraries Book Quiz -  Round 17  Initial Impressions,2020-09-14 09:14:30+00:00,18,0,0,0,0.0,adult,Barnet Libraries Book Quiz
10586,2020-11-25,DJcBqQiLn6k,Barnet Libraries Pre Booked Computers,2020-11-10 09:31:13+00:00,19,0,0,0,0.0,adult,
10560,2020-11-25,6fO5M34OM4o,Silly Squad Maze Search,2020-07-28 12:46:59+00:00,22,2,0,0,0.0,child,Barnet libraries for children
10547,2020-11-25,sDrxGOvS04M,Round 8  - Graphic Novels,2020-07-17 11:33:14+00:00,28,2,0,0,0.0,adult,Barnet Libraries Book Quiz
10551,2020-11-25,jStGOB6IGE0,Code Buster Quiz,2020-07-22 13:12:23+00:00,29,0,0,0,0.0,child,Barnet libraries for children
10553,2020-11-25,Uj-SalCUqus,How to use the Scanner in Barnet Libraries,2020-07-24 07:43:57+00:00,31,0,0,0,0.0,adult,Helping you use Barnet Libraries computers
10561,2020-11-25,7gn4aVqGrKY,East Finchley Archer Drawing Competition entries,2020-07-31 12:06:33+00:00,32,0,0,0,0.0,adult,
10596,2020-11-25,Tg-l3JGwDkg,Silly Squad Poetry Fun with Conrad Burdekin,2020-08-20 16:05:20+00:00,33,0,0,0,0.0,child,Barnet libraries for children
10567,2020-11-25,EXx81jflhJk,Silly Surprise Cards,2020-08-21 13:29:41+00:00,33,2,0,0,0.0,child,Barnet libraries for children
10566,2020-11-25,7LIqWExl43k,Barnet Libraries Book Quiz  - Round 14   Fictional Worlds,2020-08-19 15:43:51+00:00,34,2,0,0,0.0,adult,Barnet Libraries Book Quiz
10577,2020-11-25,2q8gXUV1R0M,Look Up Storytime  - celebrating Black History Month,2020-10-06 07:54:56+00:00,35,2,0,0,0.0,child,Barnet libraries for children
10537,2020-11-25,blFj6tr7eYs,Silly Squad Code Breaker,2020-07-02 07:35:20+00:00,35,3,0,0,0.0,child,Barnet libraries for children
10554,2020-11-25,QJ9rUT5TN-g,How to print from a Library Computer,2020-07-24 07:43:21+00:00,36,0,0,0,0.0,adult,Helping you use Barnet Libraries computers
10550,2020-11-25,qdyLDMR71R4,Under the Sea Art with Jayne,2020-07-22 13:34:58+00:00,36,1,0,0,0.0,child,Barnet libraries for children
10571,2020-11-25,Diruw1NLN34,Silly photo booth props,2020-08-24 07:23:42+00:00,37,2,0,0,0.0,child,Barnet libraries for children
10527,2020-11-25,SDWM_RewRoE,#In5words Book Reviews,2020-06-03 08:07:34+00:00,41,2,0,0,0.0,adult,
10508,2020-11-25,bm_ioU4b4fM,How to use your Barnet Libraries account online,2020-05-07 16:04:27+00:00,41,1,0,0,1.0,adult,
10576,2020-11-25,4RPEiD-J9Kc,Barnet Libraries Book Quiz Round 18  -   One Word Book Titles,2020-09-25 18:00:15+00:00,41,2,0,0,0.0,adult,Barnet Libraries Book Quiz
10565,2020-11-25,tDmSJhBy0vM,Barnet Libraries Book Quiz  - Round 13   What the Dickens?,2020-08-17 17:34:13+00:00,45,2,0,0,0.0,adult,Barnet Libraries Book Quiz
10578,2020-11-25,iyC9sK8cqP8,Unicorn Marionette craft activity,2020-10-13 07:37:36+00:00,46,2,0,0,0.0,child,Barnet libraries for children
10594,2020-11-25,-hVZszP6EFc,Firework Craft activity,2020-11-01 08:00:13+00:00,48,0,0,0,0.0,child,Barnet libraries for children
10569,2020-11-25,aYRZCb5Xu74,Barnet Libraries Book Quiz - Round 15   Lost Words,2020-08-24 13:51:01+00:00,48,2,0,0,0.0,adult,Barnet Libraries Book Quiz
10563,2020-11-25,WR3vHjceOUE,Barnet Libraries Book Quiz  Round 11 - Culturally Diverse Authors,2020-08-07 18:00:10+00:00,49,1,0,0,,adult,Barnet Libraries Book Quiz
10572,2020-11-25,KIvCmD5LxF4,Barnet Libraries Book Quiz - Round 16  Classic Books,2020-08-25 15:20:22+00:00,49,0,0,0,0.0,adult,Barnet Libraries Book Quiz
10590,2020-11-25,yuyoIerWmTU,Barnet Book Quiz Round 12 -  Biographies,2020-08-14 18:00:11+00:00,49,1,0,0,0.0,adult,Barnet Libraries Book Quiz
10575,2020-11-25,R80Ap34b6oc,Barnet Libraries Select & Collect Service,2020-09-22 14:06:38+00:00,51,1,0,0,0.0,adult,
10568,2020-11-25,HzbdoURyv9U,Silly Spoons Craft Activity,2020-08-21 11:42:16+00:00,55,2,0,0,0.0,child,Barnet libraries for children
10526,2020-11-25,LsZNjNwBaTI,Gallery of Recreated Bookcover Art,2020-06-01 07:33:23+00:00,57,1,0,0,0.0,adult,
10548,2020-11-25,nOGvEYL1o8o,Barnet Libraries Book Quiz Round 9   London Links,2020-07-21 07:11:24+00:00,58,1,0,0,0.0,adult,Barnet Libraries Book Quiz
10538,2020-11-25,nHkc42hBxlQ,Silly Squad Odd one out,2020-07-02 07:22:59+00:00,58,2,0,0,0.0,child,Barnet libraries for children
10509,2020-11-25,nxt7kT1plXg,Barnet Libraries Origami with Hennal Part 4 - Create a Transforming Star,2020-05-14 09:00:15+00:00,59,2,0,0,0.0,all,Barnet Libraries arts and crafts for all ages
10531,2020-11-25,1zLHM9nOUg8,Barnet Libraries Book Quiz - Round 5  Anagrams,2020-06-17 16:29:12+00:00,64,2,0,0,0.0,adult,Barnet Libraries Book Quiz
10541,2020-11-25,PTKcv0ccLfY,Owl puppet craft activity,2020-06-15 13:57:39+00:00,65,2,0,0,0.0,child,Barnet libraries for children
10544,2020-11-25,Qk0ctf7lPHU,Barnet Libraries Book Quiz Round 7 -  Opening Lines,2020-07-09 14:50:03+00:00,66,1,0,0,0.0,adult,Barnet Libraries Book Quiz
10582,2020-11-25,4IMN_tBIZO8,Halloween Storytime with Tracey the Witch from Barnet Libraries,2020-10-16 12:32:16+00:00,67,1,0,0,0.0,child,Barnet libraries for children
10579,2020-11-25,jv_Av7JZjuc,Pioneering Black Britons  - A specialist Quiz for Black History Month 2020,2020-10-14 08:01:39+00:00,69,1,0,0,0.0,adult,
10585,2020-11-25,aYDwQDbBAWk,Diwali Delights,2020-11-10 13:04:37+00:00,71,1,0,0,0.0,child,Barnet libraries for children
10535,2020-11-25,yJyeevb2OCA,DIY Clay Jewellery Dish Craft Tutorial,2020-06-16 14:34:05+00:00,71,5,0,0,1.0,all,Barnet Libraries arts and crafts for all ages
10570,2020-11-25,zl1tvZCwMxE,Prince George goes to School  - Storytime with Tracey,2020-08-25 07:20:34+00:00,74,0,0,0,0.0,child,Barnet libraries for children
10549,2020-11-25,ikmzWf99qro,Iris Folding with Zdena,2020-07-21 11:54:41+00:00,75,2,0,0,0.0,all,Barnet Libraries arts and crafts for all ages
10514,2020-11-25,2st-JbmMjlI,Barnet Libraries - Elmer Collage craft activity,2020-05-21 08:44:17+00:00,76,2,0,0,0.0,child,Barnet libraries for children
10536,2020-11-25,PkwyYIKr3as,Silly Squad Memory Game,2020-06-30 16:07:17+00:00,80,1,0,0,0.0,child,Barnet libraries for children
10580,2020-11-25,0iJVZK12m40,Ghost Lanterns - Halloween craft event,2020-10-19 07:15:09+00:00,86,1,0,0,0.0,child,Barnet libraries for children
10532,2020-11-25,SeeExemtAUw,Barnet Libraries Book Quiz Round 4   A Question of Crime,2020-06-19 18:00:13+00:00,95,5,0,0,0.0,adult,Barnet Libraries Book Quiz
10593,2020-11-25,-WBN0gH1beo,First Day at Bug School  - Storytime with Tracey,2020-08-21 09:00:10+00:00,96,2,0,0,0.0,child,Barnet libraries for children
10539,2020-11-25,7RI02Al2luU,Barnet Libraries Book Quiz -  Round 6  Children's Literature,2020-07-02 06:59:55+00:00,97,2,0,0,0.0,adult,Barnet Libraries Book Quiz
10520,2020-11-25,aCOnYEP6Kdg,How to join Barnet libraries online,2020-05-27 07:16:24+00:00,99,1,0,0,0.0,adult,Barnet Libraries - Instructions for using online services
10505,2020-11-25,8Ga3sKMJyz0,May the 4th be with you - Origami Book Marks. A Barnet libraries event with Becca,2020-05-04 13:54:26+00:00,105,2,0,0,0.0,child,Barnet libraries for children
10533,2020-11-25,oljUMIqIMZg,Wow said the Owl Storytime,2020-06-19 12:37:19+00:00,106,2,0,0,0.0,child,Barnet libraries for children
10545,2020-11-25,A4eVujjhwBo,Your Bookstart pack,2020-07-09 12:15:48+00:00,111,3,0,0,1.0,child,
10555,2020-11-25,0NzV_y9I2nU,"Go, Go, Pirate Boat - Storytime",2020-07-24 12:01:50+00:00,114,2,0,0,0.0,child,
10588,2020-11-25,fMaCMvxaeIo,Barnet Libraries Book Quiz -  Round 3 Books into Films,2020-06-12 18:00:11+00:00,115,2,0,0,0.0,adult,Barnet Libraries Book Quiz
10564,2020-11-25,fvbC3zsnE54,How to use Ancestry at home,2020-08-12 07:14:59+00:00,115,2,1,0,1.0,adult,Barnet Libraries - Instructions for using online services
10546,2020-11-25,shsYyhW4q1Q,Juggling with Keith - Learn the 3-Ball Cascade,2020-07-13 11:21:38+00:00,116,9,0,0,0.0,child,Barnet libraries for children
10573,2020-11-25,Ss6kWbMfjog,Make a Joke Book Craft Activity,2020-09-02 07:00:30+00:00,117,1,1,0,0.0,child,Barnet libraries for children
10595,2020-11-25,RavYQP5GuuE,'So Much' Storytime with Justina,2020-06-13 09:00:10+00:00,118,2,0,0,0.0,child,Barnet libraries for children
10499,2020-11-25,hr7ETReLIXU,Learn Origami with Hennal - Part 3  Make a Bunny Rabbit,2020-04-29 07:00:28+00:00,119,2,0,0,0.0,all,Barnet Libraries arts and crafts for all ages
10529,2020-11-25,76VHflXGnH0,Tips for Reading to your Newborn Baby,2020-06-11 07:19:49+00:00,122,1,0,0,0.0,child,Barnet libraries for children
10513,2020-11-25,9eFCtGId4_Q,Barnet Libraries celebrate Elmer Day. Make an Origami Elmer with Hennal,2020-05-21 08:09:34+00:00,123,6,0,0,0.0,child,Barnet libraries for children
10500,2020-11-25,h80aBxH7Rqg,How to search for and reserve an eAudiobook on the BorrowBox App,2020-04-28 11:57:06+00:00,126,3,0,0,0.0,adult,Barnet Libraries - Instructions for using online services
10584,2020-11-25,Mds8iPYC3EU,There's a Witch in your Book Storytime with Becca the Library Witch,2020-10-22 08:29:55+00:00,138,1,0,0,0.0,child,Barnet libraries for children
10592,2020-11-25,thhzQyUo2vs,Dinosaur Hat Craft activity,2020-06-15 09:00:12+00:00,144,5,1,0,0.0,child,Barnet libraries for children
10540,2020-11-25,YtaU3tgJe5g,Silly Squad Snap!,2020-07-01 14:38:39+00:00,147,6,0,0,0.0,child,Barnet libraries for children
10530,2020-11-25,FNOxiK3POM4,Rhymes for newborn babies,2020-06-11 09:16:52+00:00,165,2,0,0,0.0,child,Barnet libraries for children
10493,2020-11-25,6521sN0ioWQ,Barnet Libraries Painting with Marbles! Learn this painting technique with Becca.,2020-04-23 09:56:39+00:00,172,4,0,0,0.0,child,Barnet libraries for children
10490,2020-11-25,_vH5Hb1k-CM,Learn Origami with Hennal - Part 2 Make a Tulip! Brought to you by Barnet Libraries.,2020-04-25 07:00:21+00:00,172,8,0,0,0.0,all,Barnet Libraries arts and crafts for all ages
10492,2020-11-25,75NYFHaq91g,Fun with Bears and Books  - A Barnet Libraries event with Tracey.,2020-04-23 16:19:34+00:00,179,8,0,0,0.0,child,Barnet libraries for children
10557,2020-11-25,WBKGm9DWF7E,There's a Hole in the Bottom of the Sea  -  Storytime,2020-07-27 07:48:10+00:00,181,1,1,0,0.0,child,Barnet libraries for children
10510,2020-11-25,V14tscU4gc8,Kitchen Cupboard Musical Instruments,2020-05-15 09:00:14+00:00,195,4,0,0,0.0,child,Barnet libraries for children
10512,2020-11-25,BCLXzs5Jxao,Animal Storytime with Tracey,2020-05-20 13:00:06+00:00,203,2,1,0,0.0,child,Barnet libraries for children
10516,2020-11-25,I7mk13Y_hJc,Crafty Crocodiles  - children's craft activity,2020-05-15 16:35:17+00:00,207,3,0,0,0.0,child,Barnet libraries for children
10534,2020-11-25,It8w58fYuPg,Do the Dinosaur  - Story and Song Time,2020-06-18 14:39:57+00:00,223,2,0,0,0.0,child,Barnet libraries for children
10521,2020-11-25,WCMwi_12BZA,Rainbow Storytime with Tracey,2020-05-27 07:40:05+00:00,225,3,0,0,0.0,child,Barnet libraries for children
10495,2020-11-25,yerjgsDsKKs,Learn Origami with Hennal - Part 1 A simple box or desk tidy. Brought to you by Barnet Libraries.,2020-04-22 07:42:02+00:00,234,11,0,0,0.0,all,Barnet Libraries arts and crafts for all ages
10556,2020-11-25,IAzOsFqWuok,Seaside Songs and Rhymes,2020-07-24 14:04:27+00:00,245,2,1,0,0.0,child,Barnet libraries for children
10494,2020-11-25,_aPADMmhzKA,Staying Safe at Home Song -  a message from Barnet Libraries early years team.,2020-04-23 08:00:12+00:00,256,3,0,0,0.0,child,Barnet libraries for children
10501,2020-11-25,dR9sEdS1kJA,How to borrow an eAudiobook on the BorrowBox App,2020-04-28 11:54:08+00:00,262,4,0,0,1.0,adult,Barnet Libraries - Instructions for using online services
10518,2020-11-25,0bDbnwLsC2E,Animal Rhymes with Crocodiles,2020-05-21 16:50:14+00:00,263,2,0,0,0.0,child,Barnet libraries for children
10515,2020-11-25,1QVcXsKAhLY,Barnet Libraries quiz  - Round 1 Book Covers,2020-05-20 09:45:36+00:00,281,6,0,0,0.0,adult,Barnet Libraries Book Quiz
10497,2020-11-25,UGbpilB51OI,Barnet Libraries Rainbow Heart Craft with Zdena,2020-04-15 15:33:19+00:00,284,10,0,0,0.0,child,Barnet libraries for children
10543,2020-11-25,ir3raD6d2-Y,Silly Squad Quiz,2020-07-09 15:17:20+00:00,297,10,0,0,0.0,child,Barnet libraries for children
10542,2020-11-25,kPTZKphtYWk,All Time Favourite Rhymes with Jayne,2020-06-26 09:00:10+00:00,314,4,0,0,0.0,child,Barnet libraries for children
10589,2020-11-25,jgq18xHSsSw,Barnet Libraries Book Quiz Round 10 -  Nordic Noir,2020-07-31 18:00:11+00:00,316,8,0,0,1.0,adult,Barnet Libraries Book Quiz
10591,2020-11-25,m5xIRRIkAqQ,Barnet Ghosts,2020-10-30 14:30:12+00:00,337,8,1,0,0.0,adult,Barnet Local Studies
10581,2020-11-25,WM6ynTrH-5U,“Before Windrush” Barnet’s Black History from the 17th to the early 20th centuries.,2020-10-17 08:00:11+00:00,384,6,0,0,1.0,adult,Barnet Local Studies
10517,2020-11-25,nDbxU4US1Rk,Barnet libraries - Counting Rhymes with Jayne,2020-05-12 08:04:23+00:00,433,2,1,0,0.0,child,Barnet libraries for children
10528,2020-11-25,Q59iCWigdUQ,Garden themed Story & Rhyme time,2020-06-05 16:54:03+00:00,435,7,0,0,0.0,child,Barnet libraries for children
10524,2020-11-25,XO8Cq3b3XCY,Our Bodies -  Story and Rhyme Time,2020-05-28 12:15:53+00:00,467,6,0,0,0.0,child,Barnet libraries for children
10496,2020-11-25,SDDzDMiXkHI,Barnet Libraries Kaleidoscope Craft with Becca,2020-04-16 12:05:19+00:00,469,9,1,0,0.0,child,Barnet libraries for children
10511,2020-11-25,zGUd-xTg5Fs,Barnet Libraries Songs and Rhymes with Instruments,2020-05-18 08:45:00+00:00,515,7,0,0,0.0,child,Barnet libraries for children
10523,2020-11-25,3j8A-AGIGmE,Dot Mandala Coaster Tutorial with Amanda - a craft tutorial from Barnet Libraries,2020-06-01 11:59:57+00:00,525,13,0,0,2.0,all,Barnet Libraries arts and crafts for all ages
10502,2020-11-25,PEB8uHatmGc,Get started with the BorrowBox App for eAudio books,2020-04-28 11:47:15+00:00,574,6,0,0,0.0,adult,Barnet Libraries - Instructions for using online services
10552,2020-11-25,DUR0urc_reI,A Balloon Trip over High Barnet in the 1860's,2020-07-23 15:02:56+00:00,672,12,0,0,2.0,adult,Barnet Local Studies
10522,2020-11-25,eXNAvEOQcuc,Barnet Libraries Book Quiz  - Round 2 Missing Vowels,2020-05-29 07:44:35+00:00,687,6,0,0,0.0,adult,Barnet Libraries Book Quiz
10504,2020-11-25,65CpFDlMljY,Pyjamarama 2020 - My Pet Star Story and Rhyme event with Tracey,2020-05-01 08:30:02+00:00,843,8,0,0,0.0,child,Barnet libraries for children
10525,2020-11-25,zPnyWgwatzs,Baby Rhyme Time with Tracey,2020-05-28 07:06:41+00:00,877,4,0,0,0.0,child,Barnet libraries for children
10498,2020-11-25,guFtSqHU6pk,The Story of Finchley Common from Barnet libraries and local studies.,2020-04-27 08:01:25+00:00,914,20,0,0,3.0,adult,Barnet Local Studies
10506,2020-11-25,AQufCIv82eM,"Car, Car, Truck, Jeep  - A transport themed Rhyme and Story Time with Jayne from Barnet Libraries.",2020-05-06 05:00:02+00:00,987,9,0,0,0.0,child,Barnet libraries for children
10507,2020-11-25,72kCoEhfIjE,Wartime Barnet - VE Day 75. Barnet's Local Studies team look back at the borough at war.,2020-05-06 11:46:07+00:00,988,20,0,0,0.0,adult,Barnet Local Studies
10488,2020-11-25,aE7wqHnNzmA,Barnet Libraries Baby Bounce & Play with Jayne,2020-04-09 12:35:07+00:00,1265,17,0,0,0.0,child,Barnet libraries for children
10503,2020-11-25,Hpng6KwBEk8,Barnet Libraries Origami Animal Bookmarks,2020-05-01 08:00:13+00:00,1268,17,0,0,0.0,child,Barnet libraries for children
10519,2020-11-25,LMGd2cSq4KU,By Steam from Finsbury Park to Edgware.,2020-05-26 08:50:36+00:00,1328,28,0,0,9.0,adult,Barnet Local Studies
10491,2020-11-25,bgEQkyFTmU0,Farmyard Rhyme Time with Jayne,2020-04-23 18:41:22+00:00,1607,19,1,0,0.0,child,Barnet libraries for children
10489,2020-11-25,iAg127__YVo,Barnet Libraries Sing and Move with Tracey,2020-04-16 13:37:20+00:00,1614,18,0,0,0.0,child,Barnet libraries for children
10487,2020-11-25,O-3kfbECiYw,Barnet Libraries Rhyme Time with Tracey No 1,2020-04-02 17:29:35+00:00,5564,71,2,0,0.0,child,Barnet libraries for children
